title,author,DOI_link,DOI,vol,JOURNAL,profile_c
Effect of Mineral Fertilization on the Essential Oil Composition of Tagetes patula L. from Bulgaria,"A. Stojanova, T. Primova, Ch. Anastassov",https://doi.org/10.1080/10412905.2000.9712169,10.1080/10412905.2000.9712169,"VOL. 12, 609-612 (Sep/Oct 2000)",Journal of Essential Oil Research,JETpapl2000lea#JETpapl2000flo
Effect of Planting Time on the Yield of the Essential Oil and Artemisinin in Artemisia annua Under Subtropical Conditions,"M.Ram,M. M. Gupta, A. A .Naqvi and S.Kumar",https://doi.org/10.1080/10412905.1997.9699458,10.1080/10412905.1997.9699458,"VOL. 9, 193-197 (Mar/Apr 1997)",Journal of Essential Oil Research,JEAanch1997Lea
"Effect of the Leaf Drying and Geographic Sources on the Essential Oil Composition of Juniperus thurifera L. var. Africana Maire from the Tensift - Al Haouz, Marrakech Region.","Nadia Achak, Abderrahmane Romane, Mohamed Alifriqui & Robert P. Adams",https://doi.org/10.1080/10412905.2008.9699990,10.1080/10412905.2008.9699990,"VOL. 20, 200-204 (May/June 2008)",Journal of Essential Oil Research,JEJthailktealhamam2008leaf#JEJthfoistealhamam2008lead#JEJthailktealhamam2008lead#JEJthfoistealhamam2008leaf#JEJthplofmatealhamam2008leaf#JEJthplofmatealhamam2008lead
Effect of Water Stress and Potassium Humate on the Productivity of Oregano Plant using saline and fresh water irrigation,"H.A.H Said-Al Ahl, M.S.Hussein",https://doi.org/10.1021/jf990835x,10.1021/jf990835x,"VOL. 3(1), 125-141 (March 2010)",Ozean Journal of Applied Sciences,JEOvueg2010her
Effects of Mentha longifolia essential oil on ruminal and abomasal longitudinal smooth muscle in sheep,"Ghader Jalilzadeh-Amin, Massoud Maham, Bahram Dalir-Naghadeh & Farshad Kheiri",https://doi.org/10.1080/14786410701394142,10.1080/14786410701394142,"VOL. 24, 61-69 (Jan/Feb 2012)",Journal of Essential Oil Research,JEMlourir2012Aer
"Effects of¬†Cinnamomum zeylanicum and Ocimum basilicum¬†essential oils on the growth of¬†Staphylococcus aureus¬†ATCC 29213 and gene expression of enterotoxins A, C and E",Maryam Azizkhani & Mahnoosh Parsaeimehr,https://doi.org/10.1080/10412905.2015.1065774,10.1080/10412905.2015.1065774,"VOL. 27, 506-513 (Nov/Dec 2015)",Journal of Essential Oil Research,JEAroheutin79533055182015aer#JEArochutin79352988952015aer
"Enantiomer differentiation of key volatile constituents from leaves, stems, rhizome and flowers of cultivated¬†Hedychium coronariumKoenig from India","Pragadheesh V. Shanmugam, Anju Yadav & C.S. Chanotiya",https://doi.org/10.1080/10412905.2014.987929,10.1080/10412905.2014.987929,"VOL. 27, 101-106 (Mar/Apr 2015)",Journal of Essential Oil Research,JEPKuin2015aer#JEHcoin2015rhi#JECflin2015roo#JEPKuin2015roo
Epicuticular Wax of Juvenile Eucalyptus Leaves and Headspace Analysis of Leaf Volatiles,"Michelle G. Wirthensohn, Margaret Sedgley & Graham P.",https://doi.org/10.1080/10412905.2000.9699550,10.1080/10412905.2000.9699550,"VOL. 12, 401-411 (July/Aug 2000)",Journal of Essential Oil Research,JEEkrau2000Lea#JEEmaau2000Lea#JEEguau2000Lea#JEEbrau2000Lea
Epicuticular Wax of Juvenile Eucalyptus Leaves and Headspace Analysis of Leaf Volatiles,"Michelle G. Wirthensohn, Margaret Sedgley, Graham P. Jones",https://doi.org/10.1080/10412905.2000.9699550,10.1080/10412905.2000.9699550,"VOL. 12, 401-411 (July/Aug 2000)",Journal of Essential Oil Research,JEEmasoau2000lea#JEEorsoau2000lea#JEEkrsoau2000lea#JEEbrsoau2000lea#JEEgusoau2000lea#JEEcrsoau2000lea
Essential Composition of Aloysia gratissima From Brazil,"Graziella Trovati, Gilberto O. Chierice, Edger A. Sanches, Mario S. Galhiane.",https://doi.org/10.1080/10412905.2009.9700183,10.1080/10412905.2009.9700183,"VOL. 21, 325-328 (July/Aug 2009)",Journal of Essential Oil Research,JEAgrbr2009Aer
Essential Leaf Oil Composition of Myrrhis odorata (L.) Scop. Grown in Finland,"Jouko S. Uusitalo, Jorma E. Jalonen, Abbas Aflatuni & Sirkka L. Luoma",https://doi.org/10.1080/10412905.1999.9701174,10.1080/10412905.1999.9701174,"VOL. 11, 423-425 (Juy/Aug1999)",Journal of Essential Oil Research,JEModfi1999Lea
"Essential Oil-Bearing Plants from Nigeria: Studies on Vernonia perrottettii (Leaf and Stem Bark), Young Leaves from Eucalyptus decaisneana and Immature Leaves of Hyptis suaveolens","Akinola O. Ogunbinu, Sunday O. Okeniyi, Guido Flamini, Pier L. Cioni, Isiaka A. Ogunwande, E.T. Olayinka",https://doi.org/10.1080/10412905.2009.9700137,10.1080/10412905.2009.9700137,"VOL. 21, 154-158 (Mar/Apr 2009)",Journal of Essential Oil Research,JEVpeisni2009lea#JEVpeisni2009ste#JEEdeiwni2009lea
"Essential Oil-Bearing Plants from Nigeria: Studies on Vernonia perrottettii (Leaf and Stem Bark), Young Leaves from Eucalyptus decaisneana and Immature Leaves of Hyptis suaveolens","Akinola O. Ogunbinu, Sunday O. Okeniyi, Guido Flammini, Pier L. Cioni, Isiaka A. Ogunwande, E.T. Olayinka",https://doi.org/10.1080/10412905.2009.9700137,10.1080/10412905.2009.9700137,"VOL. 21, 154-158 (Mar/Apr 2009)",Journal of Essential Oil Research,JEHsuni2000Lea#JEHsuni2009Lea
Essential Oil Analyses of The Root Oils Of 10 Bupleurum Species From China,"Xiu-Qin Li, Zhong-Gui He, Kai-Shun Bi, Zong-Hua Song & Liang Xu",https://doi.org/10.1080/10412905.2007.9699268,10.1080/10412905.2007.9699268,"VOL. 19, 234‚Äì238 (May/June 2007)",Journal of Essential Oil Research,JEBmach2007Roo#JEBmalch2007Roo#JEBmich2007Roo#JEByich2007Roo#JEBsmch2007Roo#JEBwech2007Roo#JEBloch2007Roo#JEBbich2007Roo#JEBchch2007Roo#JEBscch2007Roo
Essential Oil analysis of Curcuma aeruginosa Leaves from south india,"Leopold Jirovetz, Gerhard Buchbauer, Christiane Puschmann, Mohamed P.Shafi, M.K.Geetha Nambiar",https://doi.org/10.1080/10412905.2000.9712039,10.1080/10412905.2000.9712039,"VOL. 12, 47-49 (Jan/Feb 2000)",Journal of Essential Oil Research,JECaecaunkein2000Lea
Essential Oil Analysis of Fuernrohria setifolia C. Koch from Iran,"Ali Sonboli, Peyman Salehi & Masoud Mohammadi Vala",https://doi.org/10.1080/10412905.2007.9699228,10.1080/10412905.2007.9699228,"VOL. 19, 47‚Äì48 (Jan/Feb 2007)",Journal of Essential Oil Research,JEFseir2007Aer
Essential Oil Analysis of Hemidesmus indicus R.Br. Roots from Southern India.,"Leopold Jirovetz, Gerhard Buchbauer, Martina Hoferl, Mohamed P. Shafi, P.G. Sagaran.",https://doi.org/10.1080/10412905.2002.9699914,10.1080/10412905.2002.9699914,"VOL. 14, 437-438 (Nov/Dec 2002)",Journal of Essential Oil Research,JEHincaunkein2002Roo
Essential Oil Analysis of Micromeria nubigena H.B.K. and its Antimicrobial Activity,"Hesham R. El-Seedi, Awatef Khattab, Ahmed H.M. Gaara, Tahia K. Mohamed, Naser A. Hassan, Amel E. El-kattan",https://doi.org/10.1080/10412905.2008.9700057,10.1080/10412905.2008.9700057,"VOL. 20, 452-456 (Sep/Oct 2008)",Journal of Essential Oil Research,JEMnueg2008Lea
Essential Oil Analysis of Spilanthes acmella Murr. Fresh Plants from Southern India,"Leopold Jirovetz, Gerhard Buchbauer, Andrea Wobus, Mohamed P.Shafi, George T. Abraham",https://doi.org/10.1080/10412905.2005.9698952,10.1080/10412905.2005.9698952,"VOL. 17, 429-431 (July/Aug 2005)",Journal of Essential Oil Research,JESackein2005Who
Essential Oil Analysis of Two Endemic Eryngium Species from Serbia,"Chrysostomos Capetanos, Vasiliki Saroglou, Peter D. Marin, Simic, Helen D. Skaltsa",https://doi.org/10.2298/jsc0710961c,10.2298/jsc0710961c,"VOL. 72(10), 961-965 (2007)",Journal of the Serbian Chemical Society,JEEsese2007Aer#JEEpase2007Aer
Essential Oil and Headspace Analysis of the Maritime Bombycilaena erecta and Otanthus maritimus Species Growing Wild in Greece,"Maria Tsoukatou, Constantinos Vagias, Catherine Harvala & Vassilios Roussis",https://doi.org/10.1080/10412905.2000.9699536,10.1080/10412905.2000.9699536,"VOL. 12, 360-364 (May/June 2000)",Journal of Essential Oil Research,JEBerisofke2000Aer
Essential Oil and Headspace Analysis of the Maritime Bombycilaena erecta and Otanthus maritimus Species Growing Wild in Greece,"Maria Tsoukatou, Constantinos Vegias, Catherine Harvala, Vassilios Roussis",https://doi.org/10.1080/10412905.2000.9699536,10.1080/10412905.2000.9699536,"VOL. 12, 360-364 (May/June 2000)",Journal of Essential Oil Research,JEOmaisofcr2000Aer
Essential Oil and Headspace Constituents from the Aerial Parts of Aster ageratoides Turcz. var. Ovatus Nakai,"Mitsuo Miyazawa, Jyunichi Kawata, Kanako Kohno, Mari Imai & Toshirou Ono",https://doi.org/10.1080/10412905.2008.9699408,10.1080/10412905.2008.9699408,"VOL. 20, 43-45 (Jan/Feb 2008)",Journal of Essential Oil Research,JEAagja2008Aer
Essential Oil Chamomile Chamomilla recutita (L.) Rausch. from Iran,"Jorge A. Pino, Farhad Bayat, Rolando Marbot, Juan Aguero",https://doi.org/10.1080/10412905.2002.9699903,10.1080/10412905.2002.9699903,"VOL. 14, 407-408 (Nov/Dec 2002)",Journal of Essential Oil Research,JECreir2002flo
Essential Oil Comparison of Hypericum perforatum L. subsp. perforatum and subsp. veronense (Schrank) Ces. from Central Italy,Filippo Maggi & Giovanni Ferretti,https://doi.org/10.1080/10412905.2008.9700067,10.1080/10412905.2008.9700067,"VOL. 20, 492-494 (Nov/Dec 2008)",Journal of Essential Oil Research,JEHpeit2008flo
Essential Oil Components in the Epigeous and Hypogeous Parts of Meum athamanticum Jacq,"Bruno Tirillini, Roberto Pellegrino, Alessandro Menghini & Barbara Tomaselli",https://doi.org/10.1080/10412905.1999.9701124,10.1080/10412905.1999.9701124,"VOL. 11, 251-252 (Mar/Apr 1999)",Journal of Essential Oil Research,JEMatit1999Epi#JEMatit1999Hyp
Essential Oil Composition and Antimicrobial Activity of Ageratum conyzoides from S. Tome and Principe,"Ana Paula Martins, Ligia R. Salgueiro, Maria Jose Goncalves, Roser Vila, Salvador Canigueral, Felix Tomi, Joseph Casanova",https://doi.org/10.1080/10412905.2005.9698888,10.1080/10412905.2005.9698888,"VOL. 17, 239-242 (May/June 2005)",Journal of Essential Oil Research,JEAcoriav2005Aer
Essential Oil Composition and Glandular Trichomes of Marrubium vulgare L. Growing Wild in Algeria,"Rachid Belhattab, Larbi Larous, A. Cristina Figueiredo, Pedro A.G. Santos, Monya M. Costa, Jos√© G. Barroso & Luis G. Pedro",https://doi.org/10.1080/10412905.2006.9699116,10.1080/10412905.2006.9699116,"VOL. 18, 369-373 (July/Aug 2006)",Journal of Essential Oil Research,JEMvuseal2006Aer
Essential Oil Composition and Internal Transcribed Spacer (ITS) Sequence Variability of Four South-Croatian Satureja Species (Lamiaceae),"Nada Bezic, Ivica Samanic, Valerija Dunkic, Visnja Besendorfer, Jasna Puizina",https://doi.org/10.3390/molecules14030925,10.3390/molecules14030925,"VOL. 14(3), 925-938 (Feb 2009)",Molecules,JEScucr2009Aer#JESvicr2009Aer#JESmocr2009Aer#JESsucr2009Aer
Essential Oil Composition Baccharis tenella Hook Et Arn.,"Fernando Biurrun, Rodolfo H. Juliani, maria L. Lopez, A. Zygadio",https://doi.org/10.1080/10412905.2005.9698849,10.1080/10412905.2005.9698849,"VOL. 17, 122-123 (Mar/Apr 2005)",Journal of Essential Oil Research,JEBtelariar2005lea
Essential Oil Composition From Leaves and Fruits of Piper divaricatum G. Mey.,"Jose Gustavo L. de Almeida, Edilberto R. Silveria, Otilia Deusdenia L. Pessoa, Edsun P. Nunes.",https://doi.org/10.1080/10412905.2009.9700155,10.1080/10412905.2009.9700155,"VOL. 21, 228-230 (May/June 2009)",Journal of Essential Oil Research,JEPdibr2009Lea#JEPdibr2009Fru
Essential Oil Composition of 'Kweda' (Pandanus odoratissimus) from India,"V.K. Raina,Ajai Kumar,S. K. Srivastava,K. V. Syamsunder",https://doi.org/10.1002/ffj.1331,10.1002/ffj.1331,"VOL. 19, 434-436 (2004)",Flavour and Fragrance Journal,JEPodin2004flo
Essential Oil Composition of Acorus calamus L. from the lower region of the Himalayas,"V. K. Raina,S. K. Srivastava,K. V. Syamasunder",https://doi.org/10.1002/ffj.1136,10.1002/ffj.1136,"VOL. 18, 18-20 (2003)",Flavour and Fragrance Journal,JEAcain2003Lea#JEAcain2003Rhi
Essential Oil Composition of Agastache foeniculum Cultivated in Iran,"R. Omidbaigi, F.Sefidkon",https://doi.org/10.1080/0972-060x.2004.10643391,10.1080/0972-060x.2004.10643391,"VOL. 15, 52-53 (Jan/Feb 2003)",Journal of Essential Oil Research,JEAfoir2003her
Essential Oil Composition of Alchemilla alpina L. em. Buser from Western Alpine Pastures,"L. Falchero, M. Coppa, S. Esposti & A. Tava",https://doi.org/10.1080/10412905.2008.9700084,10.1080/10412905.2008.9700084,"VOL. 20, 542-545 (Nov/Dec 2008)",Journal of Essential Oil Research,JEAalit2008Aer
Essential Oil Composition of Artemisia annua L. ‚ÄòAsha‚Äô from the Plains of Northern India,"Neetu Jain, S. K. Srivastava, K. K. Aggarwal, Sushil Kumar & K. V. Syamasundar",https://doi.org/10.1080/10412905.2002.9699863,10.1080/10412905.2002.9699863,"VOL. 14, 305-307 (July/Aug 2002)",Journal of Essential Oil Research,JEAanluin2002Aer
Essential Oil Composition of Artemisia chamaemelifolia Vill.,"Katayoun Morteza-Semnani, Majid Saeedi & Mohammad Akbarzadeh",https://doi.org/10.1080/10412905.2008.9700049,10.1080/10412905.2008.9700049,"VOL. 20, 430-431 (Sep/Oct 2008)",Journal of Essential Oil Research,JEAchnoir2008Aer
Essential Oil Composition of Artemisia fragrans Willd. from Iran,M.M Barazandeh,https://doi.org/10.1080/10412905.2003.9698626,10.1080/10412905.2003.9698626,"VOL. 15, 414-415 (Nov/Dec 2003)",Journal of Essential Oil Research,JEAfrir2003twi
Essential Oil Composition of Artemisia khorassanica Podl. from Iran,M.M Barazandeh,https://doi.org/10.1080/10412905.2003.9712135,10.1080/10412905.2003.9712135,"VOL. 15, 259-260 (July/Aug 2003)",Journal of Essential Oil Research,JEAkhir2003flo
Essential Oil Composition of Artemisia vulgaris Harvested at Diffrent Growth Periods Under Indo-Gangetic Plain Conditions,"Flora Haider, P.D Dwivedi, A.A. naqvi, G.D Bagchi",https://doi.org/10.1080/10412905.2003.9698615,10.1080/10412905.2003.9698615,"VOL. 15, 333-336 (Nov/Dec 2003)",Journal of Essential Oil Research,JEAvuin2003lea#JEAvuin2003flo#JEAvuin2003Fru
Essential Oil Composition of Azilia eryngiodes (Pau) Hedge et Lamond from Iran,"F.Sefidkon, M.Abdoli",https://doi.org/10.1080/10412905.2004.9698662,10.1080/10412905.2004.9698662,"VOL. 16, 103-104 (Mar/Apr 2004)",Journal of Essential Oil Research,JEAerir2004Aer
Essential Oil Composition of Baccharis articulata (Lam.) Pers.,"Maria P. Zunino, Maria L. Lopez, Julio A Zygadlo, Abel G. Lopez",https://doi.org/10.1080/10412905.2004.9698643,10.1080/10412905.2004.9698643,"VOL. 16, 29-30 (Jan/Feb 2004)",Journal of Essential Oil Research,JEBarpogaar2004leam#JEBarpogaar2004leaf
Essential oil composition of bark and leaves of Cinammoum verum Bertch and Presl from Mizoram North East India,"Lydia Malsawmtluangi, Bhagwati P. Nautiyal, Tridip Hazarika, Rajendra S. Chauhan and Aldo Tava",https://doi.org/10.1080/10412905.2016.1167131,10.1080/10412905.2016.1167131,"VOL. 28, 551-556 (Nov/Dec 2016)",Journal of Essential Oil Research,JEPfrdhpiutin2980932016lea#JEPfrtaalutin2979142016lea
Essential Oil Composition of Brazilian Pourouma species.,"Daise Lopes, Midori Koketsu, Jorge Pedro P. Carauta, Rodrigo R. de Oliveira, Maria A.C. Kaplan.",https://doi.org/10.1080/10412905.2002.9699902,10.1080/10412905.2002.9699902,"VOL. 14, 402-406 (Nov/Dec 2002)",Journal of Essential Oil Research,JEPcemadiam2002Lea#JEPmoundistofbabr2002Lea#JEPveundistofbabr2002Lea#JEPcemadiam2002Fru
Essential Oil Composition of Campomanesia adamantium (Camb) O. Berg.,"Maria Elida A. Stefanello, Armando C. Cervi, Alberto Wisniewski Jr, Edesio L. Simionatto",https://doi.org/10.1080/10412905.2008.9700047,10.1080/10412905.2008.9700047,"VOL. 20, 424-425 (Sep/Oct 2008)",Journal of Essential Oil Research,JECadcusobr2008lea
Essential Oil Composition of Centaurea calcitrapa From Algeria.,"Tahar Dob, Dahmane Dahmane, Benedicte Gauriat-Desrdy, Virgine Daligault",https://doi.org/10.1080/10412905.2009.9700151,10.1080/10412905.2009.9700151,"VOL. 21, 216-219 (May/June 2009)",Journal of Essential Oil Research,JECcaal2009Aer
Essential Oil Composition of Chaerophyllum macrospermum from Iran,F. Sefidkon & M. Abdol,https://doi.org/10.1080/10412905.2005.9698891,10.1080/10412905.2005.9698891,"VOL. 17, 249-250 (May/June 2005)",Journal of Essential Oil Research,JECmasir2005Aer
Essential Oil Composition of Cymbopogon martinni from Different places in India,"V.K. Raina,S.K. Srivastava,K.K. Aggarwal,K.V. Syamasunder,S.P.S. Khanuja", https://doi.org/10.1002/ffj.1222, 10.1002/ffj.1222,"VOL. 18, 312-315 (2003)",Flavour and Fragrance Journal,JECmain2003Her
Essential Oil Composition of Cymbopogon microstachys (Hook.) Soenarke Occurring in Manipur,"P. K. Rout, S. Sahoo & Y. R. Rao",https://doi.org/10.1080/10412905.2005.9698929,10.1080/10412905.2005.9698929,"VOL. 17, 358-360 (July/Aug 2005)",Journal of Essential Oil Research,JECmima2005Rhi
Essential Oil Composition of Different Parts of Tetraclinis articulata.,"J. Buhagiar, M. T. Camilleri Podesta, P. L. Cloni, G. Flamini, I. Morelli.",https://doi.org/10.1080/10412905.2000.9712034,10.1080/10412905.2000.9712034,"VOL. 12, 29-32 (Jan/Feb 2000)",Journal of Essential Oil Research,JETarmsma2000Con#JETarmsma2000See#JETarmsma2000Terwoo#JETarmo2000Ter#JETarmsma2000Ternwo
Essential Oil Composition of Ducrosia anethifolia (DC.) Boiss from Iran,"F. Sefidkon, I. Javidtash",https://doi.org/10.1080/10412905.2002.9699853,10.1080/10412905.2002.9699853,"VOL. 14, 278-279 (July/Aug 2002)",Journal of Essential Oil Research,JEDanir2002Aer
Essential Oil Composition of Eryngium bungei Boiss.,Katayoun Morteza-Semnani,https://doi.org/10.1080/10412905.2005.9698972,10.1080/10412905.2005.9698972,"VOL.17, 485-486 (Sep/Oct 2005)",Journal of Essential Oil Research,JEEbuir2005Aer
Essential Oil Composition of Eryngium foetidum from S. Tom√© e Pr√≠ncipe,"Ana Paula Martins, L√≠gia R. Salgueiro, Ant√≥nio Proen√ßa da Cunha, Roser Vila, Salvador Ca√±igueral, F√©lix Tomi & Joseph Casanova",https://doi.org/10.1080/10412905.2003.9712077,10.1080/10412905.2003.9712077,"VOL. 15, 93-95 (Mar/Apr 2003)",Journal of Essential Oil Research,JEEfoaf2003Aer
Essential Oil Composition of Eryngium foetidum from S.Tome e Principe,"Ana Paula Martins, Ligia R. Salgueiro, Antonio Proenca da Cunha, Roger Vila, Salvador Canigueral, Felix Tomi, Joseph Casanova",https://doi.org/10.1080/10412905.2003.9712077,10.1080/10412905.2003.9712077,"VOL. 15, 93-95 ( Mar/Apr 2003)",Journal of Essential Oil Research,JEEfogu2003Aer
Essential Oil Composition of Eryngium paludosum (Moore et Betche) P.W.Michael: An Endemic Species from Eastern Australia,"Jes√∫s Pal√°-Pa√∫l, Lachlan M. Copeland, Joseph J. Brophy & Robert J. Goldsack",https://doi.org/10.1080/10412905.2008.9700045,10.1080/10412905.2008.9700045,"VOL. 20, 416-419 (Sep/Oct 2008)",Journal of Essential Oil Research,JEEpaau2008Aer
Essential Oil Composition of Eucalyptus camaldulensis Dehn. from Mozambique,"Felisberto P. Pagula, K. H.C. Baser & Mine K√ºrk√ß√ºoglu",https://doi.org/10.1080/10412905.2000.9699530,10.1080/10412905.2000.9699530,"VOL. 12, 333-335 (May/June 2000)",Journal of Essential Oil Research,JEEcama2000leat4
Essential Oil Composition of Eucalyptus camaldulensis Dehn. from Mozambique,"Felisberto P. Pagula, K.H.C Baser, Mine Kurkcuoglu",https://doi.org/10.1080/10412905.2000.9699525,10.1080/10412905.2000.9699525,"VOL. 12, 333-335 (May/June 2000)",Journal of Essential Oil Research,JEEcama2000leat12
Essential Oil Composition of Eugenia florida and Eugenia mansoi,"Miriam A. Apel, Marcos Sobral,Elfrides E.S Schapoval, Amelia T. Henriques, Chantal Menut, Jean-Marie Bessiere",https://doi.org/10.1080/10412905.2004.9698732,10.1080/10412905.2004.9698732,"VOL. 16, 321-322 (July/Aug 2004)",Journal of Essential Oil Research,JEEflderigrdosu2004lea#JEEmamavirigrdosu2004lea
Essential Oil Composition of Ferula assa-foetida L. from Iran,"F. Sefidkon, F. Askari & M. Mirza",https://doi.org/10.1080/10412905.1998.9701010,10.1080/10412905.1998.9701010,"VOL. 10, 687-689 (Nov/Dec 1998)",Journal of Essential Oil Research,JEFasir1998Gum
Essential oil Composition of Ficus benjamina (Moraceae) and Irvingia barteri (Irvingiaceae),"Isiaka A. Ogunwande, Razaq Jimoh, Adedoyin A. Ajetunmobi, Nudewhenu O. Avoseh and Guido Flamini",https://doi.org/10.1177/1934578x1200701233,10.1177/1934578x1200701233,"VOL. 7(12), 1673-1675 (2012)",Natural Product Communications,JEFbeni2012lea#JEIbani2012lea
"Essential Oil Composition of Four Iranian Nepeta Species (N. cephalotes, N. Bornmuelleri, N. mirzayanii and N. Bracteata)",F. Sefidkon & Z. Jamzad,https://doi.org/10.1080/10412905.2007.9699274,10.1080/10412905.2007.9699274,"VOL. 19, 262-265 (May/June 2007)",Journal of Essential Oil Research,JENceir2007Aer#JENbrir2007Aer#JENmiir2007Aer#JENboir2007Aer
Essential oil composition of four Ocimum species and varieties growing in Iran,"Saeed Safari Dolatabad, Mohammad Moghaddam & Hengameh Chalajour",https://doi.org/10.1080/10412905.2014.889048,10.1080/10412905.2014.889048,"VOL. 26, 315-321 (July/August 2014)",Journal of Essential Oil Research,JEObair2014aer#JEOciir2014aer#JEOmiir2014aer
Essential Oil Composition of four Popular Indian Cultivars of Black Pepper (Piper nigrum L.).,"A. Nirmala Menon, K. P. Padmakumari, A. Jayalekshmy.",https://doi.org/10.1080/10412905.2000.9699558,10.1080/10412905.2000.9699558,"VOL. 12, 431-434 (July/Aug 2000)",Journal of Essential Oil Research,JEPniiicain2000Berkar#JEPniiicain2000Berkal
Essential Oil Composition of four Popular Indian Cultivars of Black Pepper (Piper nigrum L.).,"A. Nirmala Menona, K. P. Padmakumaria, A. Jayalekshmya, M. Gopalakrishnana & C. S. Narayanana",https://doi.org/10.1080/10412905.2005.9698877,10.1080/10412905.2005.9698877,"VOL. 12, 431-434 (July/Aug 2000)",Journal of Essential Oil Research,JEPniiicain2000Bertho#JEPniiicain2000Berara
Essential oil composition of four¬†Ocimum¬†spp. from the Peninsular India,"Ram S. Verma, Amit Kumar, Priyanka Mishra, Baskaran Kuppusamy, Rajendra C. Padalia & Velusamy Sundaresan",https://doi.org/10.1080/10412905.2015.1076742,10.1080/10412905.2015.1076742,"VOL. 28, 35-41 (Jan/Feb 2016)",Journal of Essential Oil Research,JEOgrin2016aer#JEOadin2016aer#JEOtein2016aer#JEOamin2016aer
Essential Oil Composition of Geigeria alata (DC.) Oliv. et Hiern. from Sudan,"A. A. Elegami, G. E.B. El Ghazali, W. E. Abdalla, G. Pintore, M. Chessa & B. Tirillini",https://doi.org/10.1080/10412905.2006.9699138,10.1080/10412905.2006.9699138,"VOL. 18, 448-450 (July/Aug 2006)",Journal of Essential Oil Research,JEGalsu2006Who
"Essential Oil Composition of Gmelina arborea Roxb. Verbenaceae, From Nigeria.","Dorcas O. Moronkola, Isiaka A. Ogunwande, K. Husnu Can Baser, Temel Ozek, Gulmira Ozek.",https://doi.org/10.1080/10412905.2009.9700165,10.1080/10412905.2009.9700165,"VOL. 21, 254-26 (May/June 2009)",Journal of Essential Oil Research,JEGarni2009Fru
Essential Oil Composition of Greek (Origanum vulgare ssp. hirtum) and Turkish (O. onites) Oregano: a Tool for Their Distinction,"Stella Kokkini, Effie Hanlidou, Regina Karousou, Tom Lanaras",https://doi.org/10.1080/10412905.2004.9698735,10.1080/10412905.2004.9698735,"VOL. 16, 334-338 (July/Aug 2004)",Journal of Essential Oil Research,JEOvugr2004Who#JEOontu2004Who
Essential oil composition of Himalayan Peony (Paeonia emodi Royle),"Ram S. Vermaa, Rajendra C. Padaliaa, Amit Chauhana, Anju Yadavb and Chandan S. Chanotiyab",https://doi.org/10.1080/10412905.2015.1039664,10.1080/10412905.2015.1039664,"VOL. 27, 477-480 (Nov/Dec 2015)",Journal of Essential Oil Research,JEPemin2015roo
Essential Oil Composition of Hydrocotyle umbellata L. From Venezuele.,"Luis B. Rojas, Alfredo Usubillaga, Jesus Rondon, Patricia Vit",https://doi.org/10.1080/10412905.2009.9700162,10.1080/10412905.2009.9700162,"VOL. 21, 253-254, (May/June 2009)",Journal of Essential Oil Research,JEHummeve2009Aer
Essential Oil Composition of Hypericum 'Hidcote',"Filippo Maggi, Bruno Tirillini, Sauro Vittori, Gianni Sagratini, Massimo Ricciutelli & Fabrizio Papa",https://doi.org/10.1080/10412905.2008.9700083,10.1080/10412905.2008.9700083,"VOL. 20, 539-541 (Nov/Dec 2008)",Journal of Essential Oil Research,JEH&&am2008her
Essential Oil Composition of Iranian Artemisia absinthium L. and Artemisia scoparia Waldst. et Kit,"Katayon Morteza-Semnani, Mohammad Akbarzadeh",https://doi.org/10.1080/10412905.2008.9700049,10.1080/10412905.2008.9700049,"VOL. 17, 321-322 (May/June 2005)",Journal of Essential Oil Research,JEAabir2005Aer#JEAscir2005Aer
Essential Oil Composition of Lallemantia iberica Fisch. et C.A. Mey.,Katayoun Morteza-Semnan,https://doi.org/10.1080/10412905.2006.9699055,10.1080/10412905.2006.9699055,"VOL. 18, 264-165 (Mar/Apr 2006)",Journal of Essential Oil Research,JELibir2006Aer
Essential Oil Composition of Lavandula latifolia medik from Iran,M. M. Barazandeh,https://doi.org/10.3403/30319133u,10.3403/30319133u,"VOL. 14, 80-81 (Mar/Apr 2002)",Journal of Essential Oil Research,JELlair2002flo
Essential Oil Composition of Levisticum officinalis from Iran,"Verdian Rizi Mohammad Reza, Hadjiakhoondi Abbas",10.3923/ajb.2007.161.163 ,10.3923/ajb.2007.161.163 ,"VOL. 2(2), 161-163 (2007) ",Asian Journal of Biochemistry,JELofir2007Aer
Essential Oil Composition of Ligulate and Tubular Flowers and Receptacle from Wild Chamomilla recutita (L.) Rausch. Grown in Italy,"Bruno Tirillini, Rita Pagiotti, Luigi Menghini & Giorgio Pintore",https://doi.org/10.1080/10412905.2006.9699381,10.1080/10412905.2006.9699381,"VOL. 18, 42-45 (Jan/Feb 2006)",Journal of Essential Oil Research,JECreit2006Flo
Essential Oil Composition of Major Cultivars of Black Pepper (Piper nigrum L.),"A. Nirmala Menon. K. P. Padmakumari, A. J. Jayalekshmy.",https://doi.org/10.1080/10412905.2005.9698877,10.1080/10412905.2005.9698877,"VOL. 14, 84-86 (Mar/Apr 2002)",Journal of Essential Oil Research,JEPnicain2002BerChe90#JEPnicain2002Berkot90#JEPnicain2002BerKut92#JEPnicain2002BerChe91#JEPnicain2002BerOtt90#JEPnicain2002BerOtt92#JEPnicain2002BerKut90#JEPnicain2002BerChe92#JEPnicain2002Berkot91#JEPnicain2002Berkot92#JEPnicain2002BerOtt91
