title,author,DOI_link,DOI,vol,JOURNAL,profile_c
Chemical composition of the volatile fractions from wild and in vitro plants of Anemia tomentosa var. anthriscifolia (Pteridophyta),"Shaft C. Pinto, Gilda G. Leit√£o, Aline Castellar, Diego S. D‚ÄôElia, Celso L.S. Lage, Ana√≠ze B. Henriques, Janaina Fernandes, Gl√°ucia S. Motta, Humberto R. Bizzo and Suzana G. Leit√£o",https://doi.org/10.1080/10412905.2012.755477,10.1080/10412905.2012.755477,"VOL. 25, 198-202 (May/June 2013)",Journal of Essential Oil Research,JEAtobr2013lea
Chemical Composition of the Volatile Oil from the pericarp(husk) of large cardamom(Amomum subulatum Roxb.),"J.Pura Naik,L.Jagan Mohan Rao,T.M.Mohan Kumar, S.R.Sampathu",https://doi.org/10.1002/ffj.1336,10.1002/ffj.1336,"VOL. 21, 441-444 (2004)",Flavour and Fragrance Journal,JEAsuinhi2004Per
Chemical Composition of Turkish Myrtle Oil,"T. Ozek, B. Demirci, K.H.C. Basar",https://doi.org/10.1080/10412905.2000.9712154,10.1080/10412905.2000.9712154,"VOL. 12, 541-544 (Sep/Oct 2000)",Journal of Essential Oil Research,JEMcomuma2000lea#JEMcobaer2000lea
Chemical composition of two species of Hydrocotyle (Apiaceae),"Minija Janardhanan, John Ernest Thoppil",,,NA,NA,JEHjain2002her
Chemical Composition of Two Species of Hydrocotyle (Apiaceae),"Minija Janardhanan, John Ernest Thoppil",,,"VOL. 52, 67-69 (2002)",Acta Pharmaceutica,JEHsiin2002her
Chemical Composition of volatile oil of Ageratum Conyzoides aerial parts.,Virendra S.Rana and M Amparo Blazquez,https://doi.org/10.1016/s0962-4562(03)00080-8,10.1016/s0962-4562(03)00080-8,NA,NA,JEACode2003Aer
"Chemical Composition, and Antioxidant and Antimicrobial Activities of Alpinia nutans Rosc.","Sushil Joshi, Om Prakash, Anil K. Pant, C.S. Mathela.",https://doi.org/10.1080/10412905.2010.9700270,10.1080/10412905.2010.9700270,"VOL. 22, 85-90 (Jan/Feb 2010)",Journal of Essential Oil Research,JEAnunain2010Aer#JEAnunain2010Flo
"Chemical Composition, and Antioxidant and Antimicrobial Activities of Essential Oil of Spearmint (Mentha spicata L.) From Pakistan.","Abdullah I. Hussain, Farooq Anwar, Muhammad Shahid, Muhammad Ashraf, Roman Przybylski.",https://doi.org/10.1080/10412905.2010.9700271,10.1080/10412905.2010.9700271,"VOL. 22, 78-84 (Jan/Feb 2010)",Journal of Essential Oil Research,JEMsppa2010Aer
"Chemical composition, anti-angiogenic and cytotoxicity activities of the essential oils of Cymbopogan citratus (lemon grass) against colorectal and breast carcinoma cell lines","Suthagar Pillai Piaru, Shanmugapriya Perumal, Lee Wei Cai, Roziahanim Mahmud, Amin Malik Shah Abdul Majid, Sabariah Ismail¬†& Che Nin Man",https://doi.org/10.1080/10412905.2012.703496,10.1080/10412905.2012.703496,"VOL. 24, 453-459 (Sep/Oct 2012)",Journal of Essential Oil Research,JECcima2012gra
"Chemical Composition, Antibacterial And Antioxidant Activities Of Leaves Essential Oils From Syzygium Cumini L., Cupressus Sempervirens L. And Lantana Camara L. From Egypt","Hosam O. Elansary1, Mohamed Z.M. Salem2, Nader A. Ashmawy3 & Mohamed M. Yacout4",https://doi.org/10.5539/jas.v4n10p144,10.5539/jas.v4n10p144,"Vol 4, No. 10; (2012)",Journal Of Agricultural Science,JELcaeg2012Lea
"Chemical Composition, Antibacterial and Fungicidal Activities of Leaf Oil of Plectranthus amboinicus (Lour.) Spreng.","Jos√© G.M. da Costa, Carla K.B. Pereira, Fab√≠ola F.G. Rodrigues & Sidney G. de Lima",https://doi.org/10.1080/10412905.2010.9700298,10.1080/10412905.2010.9700298,"VOL. 22, 183-185 (Mar/Apr 2010)",Journal of Essential Oil Research,JEPambr2010Lea
"Chemical Composition, Antifungal and In Vitro Antioxidant Properties of Monarda didyma L. Essential Oil","Daniele Fraternale, Laura Giamperi, Anahi Bucchini, Donata Ricci, Francesco Epifano, Giovanni Burini & Massimo Curini",https://doi.org/10.1080/10412905.2006.9699174,10.1080/10412905.2006.9699174,"VOL. 18, 581-585 (Sep/Oct 2006)",Journal of Essential Oil Research,JEMdiit2006Ste#JEMdiit2006Flo
"Chemical composition, antimicrobial and antioxidant activities of essential oil of¬†Salvia chudaei¬†Batt. et Trab. endemic plant from Algeria","Soumeya Krimat, Tahar Dob, Mohamed Toumi, Lynda Lamari & Dahmane Dahmane",https://doi.org/10.1080/10412905.2015.1025921,10.1080/10412905.2015.1025921,"VOL. 27, 447-453 (Sep/Oct 2015)",Journal of Essential Oil Research,JESchso2015ari
"Chemical composition, antimicrobial and antioxidant activities of the essential oil of Lippia javanica leaves from Ethiopia","Anwar Endris, Nigist Asfaw and Daniel Bisrat",https://doi.org/10.1080/10412905.2015.1108880,10.1080/10412905.2015.1108880,"VOL. 28, 221-226 (May/Jun 2016)",Journal of Essential Oil Research,JEDtequ2016Lea
"Chemical Composition, Antimicrobial and Antioxidant Properties of the Volatile Oil and Methanol Extract of Xenophyllum poposum","Ana M. Gonz√°lez, Mar√≠a I. Tracanna, Sara M. Amani, Carola Schuff, Miguel J. Poch, Horacio Bach  and C√©sar A. N. Catal√°n",https://doi.org/10.1177/1934578x1200701230,10.1177/1934578x1200701230,"VOL. 7(12), 1663-1666 (2012)",Natural Product Communications,JEXpoar2012aer
"Chemical Composition, Antimicrobial and In Vitro Antioxidant Properties of Monarda citriodora var. citriodora, Myristica fragrans, Origanum vulgare ssp. hirtum, Pelargonium sp. and Thymus zygis Oils","H.J. Damien Dorman, Stanley G. Deans",https://doi.org/10.1080/10412905.2004.9698679,10.1080/10412905.2004.9698679,"VOL. 16, 145-150 (Mar/Apr 2004)",Journal of Essential Oil Research,JEOvuuk2004Who#JEMciuk2004Who
"Chemical composition, antioxidant and antibacterial activities of the essential oils of medicinal plant Ammodaucus leucotrichus from Algeria","Dahmane Dahmane, Tahar Dob, Soumeya Krimat, Ahmed Nouasri, Hafidha Metidji & Aicha Ksouri",https://doi.org/10.1080/10412905.2016.1201015,10.1080/10412905.2016.1201015,"VOL. 29, 48-55 (Jan/Feb 2017)",Journal of Essential Oil Research,JECcllavudidothpr2016Pee#JECauhoprir2016Roo
"Chemical composition, antioxidant and antimicrobial activity of¬†Artemisia sieberi¬†oils from different parts of Iran and France","Mohaddese Mahboubi, Mahdi Valian & Nastaran Kazempour",https://doi.org/10.1080/10412905.2014.1001526,10.1080/10412905.2014.1001526,"VOL. 27, 140-147 (Mar/Apr 2015)",Journal of Essential Oil Research,JEPleapit404047n175524e5m2015lea#JEAgmmautin79833064272015aer#JEPlecait395636n181559e172015lea
"Chemical Composition, Antioxidant, Anti-Inflammatory and Anti-Proliferative Activities of Essential Oils of Plants from Burkina Faso.","Bagora Bayala, Imael Henri Nestor Bassole, Charlemagne Gnoula1, Roger Nebie, Albert Yonli,Laurent Morel, Gilles Figueredo, Jean-Baptiste Nikiema, Jean-Marc A. Lobaccaro, Jacques Simpore",https://doi.org/10.1371/journal.pone.0092122,10.1371/journal.pone.0092122,NA,NA,JEACobufaaf2015Lea
"Chemical composition, insecticidal activity and persistence of three Asteraceae essential oils and their nanoemulsions against Callosobruchus maculatus (F.)","Gomah E. Nenaah, Sahar I.A. Ibrahim, Basma A. Al-Assiuty",https://doi.org/10.1016/j.jspr.2014.12.007,10.1016/j.jspr.2014.12.007,"VOL.61,9-16(2015)",Journal of Stored Products Research,JEACoeg2015Aer
"Chemical Composition, Mutagenic and Antimutagenic Activities of Essential Oils from(Tunisian) Artemisia campestris and Artemisia herba-alba","Neffati Aicha, Skandrani Ines, Ben Sghaier Mohamed, Bouhlel Ines, Kilani Soumaya, Ghedira Kamel, Neffati Mohamed, Chraief Imed, Hammami Mohamed & Chekir-Ghedira Leila",https://doi.org/10.1080/10412905.2008.9700061,10.1080/10412905.2008.9700061,"VOL. 20, 471-477 (Sep/Oct 2008)",Journal of Essential Oil Research,JEAhetu2008Lea#JEAcatu2008Lea
"Chemical Composition, Seasonal Variability, and Antifungal Activity of Lavandula stoechas L. ssp. stoechas Essential Oils from Stem/Leaves and Flowers","Alberto Angioni, Andrea Barra, Valentina Coroneo, Sandro Dessi,, Paolo Cabras",https://doi.org/10.1021/jf0603329,10.1021/jf0603329,"VOL. 54 (12), 4364-4370 (2006)",Journal of Agricultural and Food Chemistry,JELstit2006lea#JELstit2006flo
"Chemical Composition, Seasonal Variation and Evaluation of Antimicrobial Activity of Essential Oils of Talauma ovata A. St. Hill (Magnoliaceae)","Maria √âlida A. Stefanello, Marcos J. Salvador, Izabel Y. Ito, Alberto Wisniewski Jr, Ed√©sio L. Simionatto & Renato de Mello-Silva",https://doi.org/10.1080/10412905.2008.9700089,10.1080/10412905.2008.9700089,"VOL. 20, 565-569 (Nov/Dec 2008)",Journal of Essential Oil Research,JETovbr2008lea#JETovbr2008bar
"Chemical Composition,Antibacterial and Antimutagenic Activities of Essential Oil from(Tunisian) Cyperus rotundus","Soumya Kilani,Alef Abdelwahed,Ribai Ben Ammar,Nawel Hayder, Kamel Ghedira,Imed Chraief,Mohammed Hammami, Leila Chekir-Ghedira",https://doi.org/10.1080/10412905.2005.9699035,10.1080/10412905.2005.9699035,"VOL. 17, 695-700 (Nov/Dec 2002)",Journal of Essential Oil Research,JECrotu2002Tub
Chemical Compositions of Two Wild Species of the Genus Salvia L. From Yugoslavia: Salvia aethiopis and Salvia verticillafa,"Jean-Claude Chalchat, M. S. Gorunovic, S. D. Petrovic & Z. A. Maksimovic",https://doi.org/10.1080/10412905.2001.9699711,10.1080/10412905.2001.9699711,"VOL. 13, 416-418 (Nov/Dec 2001)",Journal of Essential Oil Research,JESveyu2001Aer#JESaeyu2001Aer
"Chemical Compositions, Antioxidant and Antimicrobial Activity of the Essential Oils of Piper officinarum (Piperaceae)","Wan Mohd Nuzul Hakimi Wan Salleh, Farediah Ahmad, Khong Heng Yen and Hasnah Mohd Sirat",https://doi.org/10.1177/1934578x1200701229,10.1177/1934578x1200701229,"VOL. 7(12), 1659-1662 (2012)",Natural Product Communications,JEPoflusama2012lea#JEPoflusama2012ste
Chemical Constituents And Evaluation Of Cytotoxic And Antifungal Activity Of Lantana Camara Essential Oils,"L√≠dia B. P. Medeiros,1 M√°rcio dos S. Rocha,2 Sidney G. de Lima Gustavo R. de Sousa J√∫nior,1 Ant√¥nia M. das G. L. Cit√≥,1 Davi da Silva,1 Jos√© A. D. Lopes,1 Dinara J. Moura,3 Jenifer Saffi,3 Mitra Mobin,4 Jos√© G.M. da Costa",https://doi.org/10.1590/s0102-695x2012005000098,10.1590/s0102-695x2012005000098,"Vol 22(6): 1259-1267, (Nov./Dec. 2012)",Brazilian Journal Of Pharmacognosy,JELcabr2012Lea
Chemical Constituents and Larvicidal Activity of Hymenaea courbaril Fruit Peel,"Jos√© Cl√°udio D. Aguiar, Gilvandete M. P. Santiago, Patr√≠cia L. Lavor, Helenicy N. H. Veras, Yana S. Ferreira, Michele A. A. Lima, √Çngela M. C. Arriaga, Telma L. G. Lemos, Jefferson Q. Lima, Hugo C. R. de Jesus, P√©ricles B. Alves and Raimundo Braz-Filho",https://doi.org/10.1177/1934578x1000501231,10.1177/1934578x1000501231,"VOL. 5 (12), 1977-1980 (2010)",Natural Product Communications,JEHcobr2010fru
Chemical Constituents of Artemisia verlotiorum Essential Oil on Cultivation at the Subtropical Conditions of North India,"F. Haider, A. A. Naqvi & G. D. Bagchi",https://doi.org/10.1080/10412905.2006.9699164,10.1080/10412905.2006.9699164,"VOL. 18, 551-552 (Sep/Oct 2006)",Journal of Essential Oil Research,JEAvegahiin2006Aer
Chemical Constituents Of Essential Oil Of Lantana Camara Linn. Leaves,I.O. Jawonisi and 2G.I. Adoga,https://doi.org/10.19026/bjpt.4.5394,10.19026/bjpt.4.5394,"Vol 4(4): 155-157, (2013)",British Journal Of Pharmacology And Toxicology,JELcani2013Lea
Chemical Constituents of Essential Oils from Mentha longifolia (L.) Hudson var. asiatica (Boriss.) Rech. f. from Iran,K. Jaimand & M. B. Rezaee,https://doi.org/10.1080/10412905.2002.9699786,10.1080/10412905.2002.9699786,"VOL. 14, 107-108 (Mar/Apr 2002)",Journal of Essential Oil Research,JEMloir2002flo
Chemical Constituents of Essential Oils from Mentha longifolia (L.) Hudson var. asiatica (Boriss.) Rech. f. from Iran,"K. Jaimand, M. B. Rezaee",https://doi.org/10.1080/10412905.2002.9699786,10.1080/10412905.2002.9699786,"VOL. 14, 107-108 (Mar/Apr 2002)",Journal of Essential Oil Research,JEMloir2002Lea
Chemical Constituents of Flower Essential Oil of Ageratum conyzoides growing in Nigeria,"Usman L.A, Zubair M.F, Olawore N.O, Muhammad N.O, M‚ÄôCiver F.A and Ismaeel R.O",,,"VOL.54,12463-12465(2013)",Elixir Online Journal,JEAConi2013Flo
Chemical Constituents Of Fruit Essential Oil Of Lantana Camara L. Grown In Nigeria,"Usman, L.A1,*, Ismaeel, R.O1., James O.O2., Mustapha, A.O3., Adebayo, M.A1., Faleye, E.A1 and Odhiambo, P",,,"Vol 43, 6528-6530, (2012)",Organic Chemistry,JELcani2012Fru
Chemical Constituents of the Bark Oil of Goniothalamus macrophyllus Hook. F. from Malaysia,"Ibrahim bin Jantan, Fasihuddin bin Ahmad & Laily bin Din",https://doi.org/10.1080/10412905.2005.9698868,10.1080/10412905.2005.9698868,"VOL. 17, 181-183 (Mar/Apr 2005)",Journal of Essential Oil Research,JEGmama2005bar
Chemical Constituents of the Essential Oil of Ajuga austro-iranica Rech. f. (Lamiaceae) from Iran,"K. Javidnia, R. Miri, M. Soltani & A. R. Khosravi",https://doi.org/10.1080/10412905.2010.9700252,10.1080/10412905.2010.9700252,"VOL. 22, 392-394 (Sep/Oct 2010)",Journal of Essential Oil Research,JEAauir2010Aer
Chemical Constituents of the Essential Oil of Artemisia aucheri Boiss.- a Species Endemic to Iran,"Simak Khorsand Mohammadpoor, Mohammad Yari,Abdolhossein Rustaiyan, Shiva Masoudi",https://doi.org/10.1080/10412905.2002.9699792,10.1080/10412905.2002.9699792,"VOL. 14, 122-123 (Mar/Apr 2002)",Journal of Essential Oil Research,JEAauir2002Aer
"Chemical Constituents of the Essential Oil of Ferulago contracta Boiss. et Hausskn., a Species Endemic to Iran","Abdolhossein Rustaiyan, Mohammad Yari, Shiva Masoudi",https://doi.org/10.1055/s-0030-1264625,10.1055/s-0030-1264625,"VOL. 11, 609-610 (Sep/Oct 1999)",Journal of Essential Oil Research,JEFcoir1999Ste#JEFcoir1999Flo
Chemical Constituents of the Essential Oil of Hedeoma multiflorum Benth. (Lamiaceae),"Adolfina R. Koroch, H√©ctor R. Juliani Jr., Victorio S. Trippi & H√©ctor R. Juliani",https://doi.org/10.1080/10412905.1999.9701100,10.1080/10412905.1999.9701100,"VOL. 11, 165-166 (Mar/Apr 1999)",Journal of Essential Oil Research,JEHmumear1999Aer
Chemical Constituents of the Essential Oil of Lomatopodium khorassanicum Mozaffarian-a Species Endemic to Iran,"Soheila Sedghat, Abdolhossein Rustaiyan, Morteza Khosravi, Shiva Masoudi",https://doi.org/10.1080/10412905.2003.9698627,10.1080/10412905.2003.9698627,"VOL. 15, 416-417 (Nov/Dec2003)",Journal of Essential Oil Research,JELkhir2003Aer
Chemical Constituents of the Essential Oil of Mikania cordata (Burm.f.) B.L. Robinson from Abidjan (Ivory Coast),"G. Bedi, Z.F. Tonzibo, T.Y. N' Guessan, Jean-Claude Chalchat",https://doi.org/10.1080/10412905.2003.9712112,10.1080/10412905.2003.9712112,"VOL. 15, 198-199 (May/June 2003)",Journal of Essential Oil Research,JEMcoabsoivco2003lea
Chemical Constituents of the Essential Oil of Otostegia michauxii Briq. From Iran,"K. Javidnia, R. Miri, M. Soltani, A.R. Khosarvi.",https://doi.org/10.1080/10412905.2010.9700252,10.1080/10412905.2010.9700252,"VOL. 22, 1-2 (Jan/Feb 2010)",Journal of Essential Oil Research,JEOmiir2010Aer
"Chemical Constituents of the Essential Oils from leaves, flowers, stem and aerial parts of Salvia aethiopis L. from Iran","Mahmoud Tajbakhsh, Amir Rineh, Mohammad A. Khalilzadeh & Bahman Eslami",https://doi.org/10.1080/10412905.2007.9699334,10.1080/10412905.2007.9699334,"VOL. 19, 569-571 (Nov/Dec 2007)",Journal of Essential Oil Research,JESaeir2007Ste#JESaeir2007Lea#JESaeir2007Flo#JESaeir2007Aer
Chemical Constituents of the Leaf and Flower Oils from Achillea millefolium ssp. elbursensis Hub.-Mor. from Iran Rich in Chamazulene,"K. Jaimand, M. B. Rezaee & V. Mozaffarian",https://doi.org/10.1080/10412905.2006.9699093,10.1080/10412905.2006.9699093,"VOL. 18, 293-295 (May/June 2006)",Journal of Essential Oil Research,JEAmiir2006Flo#JEAmiir2006Lea
Chemical Constituents of the Leaf and Flower Oils from Anthemis altissima L. var. altissima from Iran,"M. B. Rezaee, K. Jaimand & M. H. Assarih",https://doi.org/10.1080/10412905.2006.9699049,10.1080/10412905.2006.9699049,"VOL. 18, 152-153 (Mar/Apr 2006)",Journal of Essential Oil Research,JEAalir2006Flo#JEAalir2006Lea
Chemical Constituents of the leaf and flower Oils from Anthemis triumfettii (L.) All. subsp. Triumfettii from Iran,M. B. Rezaee & K. Jaimand,https://doi.org/10.1080/10412905.2008.9699983,10.1080/10412905.2008.9699983,"VOL. 20, 172-173 (Mar/Apr 2008)",Journal of Essential Oil Research,JEAtrnoir2008Lea#JEAtrnoir2008Flo
Chemical constituents of the Volatile Oil of Cyperus esculentus L. from Nigeria,"D. Kubmarawa,I.A. Ogunwande,D.A. Okorie,N.O. Olawore,A.A. Kasali",https://doi.org/10.1002/ffj.1517,10.1002/ffj.1517,"VOL. 20, 640-641 (2005)",Flavour and Fragrance Journal,JECesni2005tub
Chemical Differences in the Essential Oil of Pimenta pseudocaryophyllus (Gomes) L. R. Landrum Leaves from Brazil,"J. A.M. de Paula, J. R. de Paula, M. T. Freitas Bara, P. H. Ferri, S. C. Santos & L. H. Soares e Silva",https://doi.org/10.1080/10412905.2010.9700385,10.1080/10412905.2010.9700385,"VOL. 22, 555-557 (Nov/Dec 2010)",Journal of Essential Oil Research,JEPpsbr2010Lea
"Chemical diversity among different accessions of¬†Origanum vulgare¬†L. ssp.¬†vulgarecollected from Central Himalayan region of Uttarakhand, India",Archana P. Raina & K.S. Negi,https://doi.org/10.1080/10412905.2014.948969,10.1080/10412905.2014.948969,"VOL. 26, 420-426 (Nov/Dec 2014)",Journal of Essential Oil Research,JEObautin297924ms2014inf#JEOamutin297924ms2014inf#JEOvuvinautin212014aer#JEOamutin297924ms2014lea#JEOkiutin297924ms2014lea#JEOgrutin297924ms2014lea#JEOvumunautin222014aer#JEOvuninautin142014aer#JEOgrutin297924ms2014inf#JEOkiutin297924ms2014inf
Chemical diversity in the volatiles of¬†Perilla frutescens¬†(L.) Britt. populations from Uttarakhand Himalaya (India),"Garima Gwari, Hema Lohani, Ujjwal Bhandari, S. Zafar Haider, Sher Singh, Harish Andola & Nirpendra Chauhan",https://doi.org/10.1080/10412905.2015.1081415,10.1080/10412905.2015.1081415,"VOL. 28, 49-54 (Jan/Feb 2016)",Journal of Essential Oil Research,JECzeir2015bar#JEAsifair2015aer#JEAsikahoabir2015aer#JEKgathin2016rhi#JEPfrduututin3078992016lea#JEAsifr2015aer#JEPfrantegautin3078172016lea#JEPfrfochutin298031152016lea#JEPfrchalutin2979982016lea#JEPfrmachdeutin3077202016lea#JEObair2015aer#JEAmamautin79833064272015aer
Chemical Examination of Essential Oils from the Leaves of Nine Eucalyptus Species Growing in Algeria,"Y. Foudil-Cherif, B. Y. Meklati, A. Verzera, L. Mondello & G. Dugo",https://doi.org/10.1080/10412905.2000.9699494,10.1080/10412905.2000.9699494,"VOL. 12, 186-191 (Mar/Apr 2000)",Journal of Essential Oil Research,JEEpual2000Lea#JEEmial2000Lea#JEEblal2000Lea#JEEleal2000Lea#JEEalal2000Lea#JEEoval2000Lea#JEEsaal2000Lea#JEEclal2000Lea
Chemical Examination of Essential Oils from the Leaves of Nine Eucalyptus Species Growing in Algeria,"Y. Foudil-Cherif, B. Y. Meklati, A. Verzera, L. Mondello & G. Dugo",https://doi.org/10.1080/10412905.2000.9699503,10.1080/10412905.2000.9699503,"VOL. 12, 186-191 (Mar/Apr 2000)",Journal of Essential Oil Research,JEEsial2000Lea
Chemical Examination of the Essential Oil of Chenopodium ambrosioides L. from the Southern Hills of India.,"Deepti Gupta, Reena Charles, V. K. Mehta, S. N. Garg, Sushil kumar.",https://doi.org/10.1080/10412905.2002.9699780,10.1080/10412905.2002.9699780,"VOL. 14, 93-94 (Mar/Apr 2002)",Journal of Essential Oil Research,JECamciin2002Aer
Chemical Investigation of a New Cultivar of Purple Basil (Ocimum basillcum cv. Opal) from Iran,"R. Omidbaigi, M. Mirzai and M. Sedghi Moghadam",https://doi.org/10.1080/0972060x.2007.10643544,10.1080/0972060x.2007.10643544,"VOL. 10(3), 209-214 (2007)",Journal of Essential Oil Bearing Plants,JEObair2007flo
Chemical Profile of the Dittrichia graveolens (Desf.) Greuter Essential Oil of Lebanese Origin,"Marwan W. Ghosn, Cyril B. Chemali, Farah I. Zaknoun & Najat A. Saliba",https://doi.org/10.1080/10412905.2006.9699136,10.1080/10412905.2006.9699136,"VOL. 18, 443-444 (July/Aug 2006)",Journal of Essential Oil Research,JEDgrle2006Lea
"Chemical profiles of volatiles in four Alpinia species from Kerala, South India","Gopan Raj, D.P. Pradeep, C. Yusufali, Mathew Dan¬†& Sabulal Baby",https://doi.org/10.1080/10412905.2012.751058,10.1080/10412905.2012.751058,"VOL. 25, 97-102 (Mar/Apr 2013)",Journal of Essential Oil Research,JEAgain2013rhi#JEAsmin2013rhi#JEAmain2013rhi#JEAcain2013rhi
Chemical profiling of essential oil ofKaempferia galanga¬†L. germplasm from India,Archana P. Raina & Z. Abraham,https://doi.org/10.1080/10412905.2015.1077165,10.1080/10412905.2015.1077165,"VOL. 28, 29-34 (Jan/Feb 2016)",Journal of Essential Oil Research,JEArogautin79293005162015aer
Chemical Screening of Essential Oil Bearing Flora of Siberia I. Composition of the Essential Oil of Galatella biflora (L.) Nees Vegetative Tops from the Altai Region,"Wudeneh Letchamo, Elena A. Korolyuk, Alexey V. Tkachev",https://doi.org/10.1080/10412905.2004.9698677,10.1080/10412905.2004.9698677,"VOL. 16, 141-142 (Mar/Apr 2004)",Journal of Essential Oil Research,JEGbisosiru2004top
Chemical Screening of Essential Oil Bearing Flora of Siberia II. Composition of the Essential Oil of Schizonepeta annua(Pallas)Schischkin Leaves from Altai Region,"Wudeneh Letchamo, Elena A. Korolyuk, Alexey V. Tkachev",https://doi.org/10.1080/10412905.2005.9698915,10.1080/10412905.2005.9698915,"VOL. 17, 314-315 (May/June 2005)",Journal of Essential Oil Research,JESanalre2005Lea
Chemical Screening of Essential Oil Bearing Flora of Siberia III. Composition of the Essential Oil of Sium latifolium L. Tops from Altai Region,"Wudeneh Letchamo, Elena A. Korolyuk & Alexey V. Tkachev",https://doi.org/10.1080/10412905.2005.9698940,10.1080/10412905.2005.9698940,"VOL. 17, 396-397 (July/Aug 2005)",Journal of Essential Oil Research,JESlasi2005Flo
Chemical Screening of Essential Oil Bearing Flora of Siberia III. Composition of the Essential Oil of Sium latifolium L. Tops from Altai Region,"Wudeneh Letchamo, Elena A. Korolyuk & Alexey V. Tkachev",https://doi.org/10.1080/10412905.2005.9698940,10.1080/10412905.2005.9698940,"VOL. 17,396-397 (July/Aug 2005)",Journal of Essential Oil Research,JESlasi2005Flo
Chemical Screening of Essential Oil Bearing Flora of Siberia III. Composition of the Essential Oil of Sium latifolium L. Tops from Altai Region,"Wudeneh Letchamo, Elena A. Korolyuk, Alexey V. Tkachev",https://doi.org/10.1080/10412905.2005.9698940,10.1080/10412905.2005.9698940,"VOL. 17, 396-397 (July/Aug 2005)",Journal of Essential Oil Research,JESlasi2005top
Chemical Screening of Essential Oil Bearing Flora of Siberia III. Composition of the Essential Oil of Sium latifolium L. Tops from Altai Region,"Wudeneh Letchamo, Elena A. Korolyuk, Alexey V. Tkachev",https://doi.org/10.1080/10412905.2005.9698940,10.1080/10412905.2005.9698940,"VOL. 17,396-397 (July/Aug 2005)",Journal of Essential Oil Research,JESlasi2005top
Chemical Screening of Essential Oil Bearing Flora of Siberia IV. Composition of the Essential Oil of Nepeta sibirica L. Tops from Altai Region,"Wudeneh Letchamo, Elena A. Korolyuk & Alexey V. Tkachev",https://doi.org/10.1080/10412905.2005.9698973,10.1080/10412905.2005.9698973,"VOL. 17, 487-489 (Sep/Oct 2005)",Journal of Essential Oil Research,JENsialre2005top
Chemical Screening of Essential Oil Bearing Flora of Siberia V. Composition of the Essential Oil of Chaerophyllum prescottii DC Tops from Altai Region,"Wudeneh Letchamo, Elena A. Korolyk & Alexey V. Tkachev",https://doi.org/10.1080/10412905.2005.9698994,10.1080/10412905.2005.9698994,"VOL. 17, 560-562 (Sep/Oct 2005)",Journal of Essential Oil Research,JECpralre2005top#JECprru2005Flo
Chemical Screening of Essential Oil Bearing Flora of Siberia. VII. Composition of the Essential Oil of Kadenia dubia (Schkuhr) Lavrova et V.N. Tichom. from Altai Region,"Alexey V. Tkachev, Elena A. Korolyuk & Wudeneh Letchamo",https://doi.org/10.1080/10412905.2005.9699019,10.1080/10412905.2005.9699019,"VOL. 17, 636-637 (Nov/Dec 2005)",Journal of Essential Oil Research,JEKdualre2005top
Chemical Screening of Essential Oil Bearing Flora of Siberia. VII. Composition of the Essential Oil of Kadenia dubia (Schkuhr) Lavrova et V.N.Tichom. from Altai Region,"Alexey V. Tkachev, Elena A. Korolyuk & Wudeneh Letchamo",https://doi.org/10.1080/10412905.2005.9699019,10.1080/10412905.2005.9699019,"VOL. 17, 636-637 (Nov/Dec 2005)",Journal of Essential Oil Research,JEKdusi2005Flo
"Chemical Screening of Volatile Oil-bearing Flora of Siberia IX. Variations in Chemical Composition of the Essential Oil of Heteropappus altaicus Willd. (Novopokr.) Growing Wild at Different Altitudes of Altai Region, Russia","Alexey V. Tkachev, Elena A. Korolyuk & Wudeneh Letchamo",https://doi.org/10.1080/10412905.2006.9699048,10.1080/10412905.2006.9699048,"VOL. 18, 149-151 (Mar/Apr 2006)",Journal of Essential Oil Research,JEHalalru2006Flo
Chemical Screening of Volatile Oil-Bearing Flora of Siberia VIII.: Variations in Chemical Composition of the Essential Oil of Wild Growing Seseli buchtormense (Fisch. ex Sprengel) W. Koch from Different Altitudes of Altai Region,"Alexey V. Tkachev, Elena A. Korolyuk, Wilfried K√∂nig, Yulia V. Kuleshova & Wudeneh Letchamo",https://doi.org/10.1080/10412905.2006.9699399,10.1080/10412905.2006.9699399,"VOL. 18, 100-103 (Jan/Feb 2006)",Journal of Essential Oil Research,JESbusi2006Flo
Chemical Screening of Volatile Oil Bearing Flora of Siberia VI. Composition of the Essential Oil of Kitagawia baicalensis (Redow. ex Willd.) Pimenov Flowering Tops from Altai Region,"Wudeneh Letchamo, Elena A. Korolyuk & Alexey V. Tkachev",https://doi.org/10.1080/10412905.2005.9699001,10.1080/10412905.2005.9699001,"VOL. 17, 577-578 (Sep/Oct 2005)",Journal of Essential Oil Research,JEKbaalre2005top#JEKbaru2005Flo
