title,author,DOI_link,DOI,vol,JOURNAL,profile_c
Hydrodistillation Kinetic and Antibacterial effect Studies of the flower Essential Oil from the Tunisian Ridolfia segetum (L.),Hichem Ben Jannet & Zine Mighri,https://doi.org/10.1080/10412905.2007.9699273,10.1080/10412905.2007.9699273,"VOL. 19, 258‚Äì261 (May/June 2007)",Journal of Essential Oil Research,JERsetu2007Flo
Identification of Components of Osage Orange Fruit (Maclura pomifera) and Their Repellency to German Cockroaches.,"Chris Peterson, Junwei Zhu, Joel R. Coats.",https://doi.org/10.1080/10412905.2002.9699833,10.1080/10412905.2002.9699833,"VOL. 14, 233-237 (May/June 2002)",Journal of Essential Oil Research,JEMpobocous2002Frusoch#JEMpobocous2002Frusogr#JEMpobocous2002Fruuncu#JEMpobocous2002Fruri#JEMpobocous2002Fruseh#JEMpobocous2002Frusem#JEMpobocous2002Fruunin
"Identification of Flavonoid Content and Chemical Composition of the Essential Oils of Moroccan Herbs: Myrtle (Myrtus communis L.), Rockrose (Cistus ladanifer L.) and Montpellier cistus (Cistus monspeliensis L.)","Manuel Viuda-Martos, Esther Sendra, Jos√© A. P√©rez-Alvarez, Juana Fern√°ndez-L√≥pez, Mahassine Amensour & Jamal Abrini",10.1080/10412905.2011.9700439,10.1080/10412905.2011.9700439,"VOL. 23, 1-9 (Mar/Apr 2011)",Journal of Essential Oil Research,JECmomo2011Lea
"Identification of Flavonoid Content and Chemical Composition of the Essential Oils of Moroccan Herbs: Myrtle (Myrtus communis L.), Rockrose (Cistus ladanifer L.) and Montpellier cistus (Cistus monspeliensis L.)","Manuel Viuda-Martos, Esther Sendra, Jos√© A. P√©rez-Alvarez, Juana Fern√°ndez-L√≥pez, Mahassine Amensour & Jamal Abrini",https://doi.org/10.1080/10412905.2011.9700439,10.1080/10412905.2011.9700439,"VOL. 23, 1-9 (Mar/Apr 2011)",Journal of Essential Oil Research,JEMcomo2011Ber#JEMcomo2011Lea#JEClamo2011Lea
Identification of the Volatile components causing the characteristic Foxy odor in various cultivars of Fritillaria imperialis L.(Liliaceae),"Johannes Petrus Franciscus gerardus Helsper,Mark Bucking,Sorel Muresan,Jan Blaas & Willem Anna Wietsma",https://doi.org/10.1021/jf0605594,10.1021/jf0605594,"VOL. 54, 5087-5091 (2006)",Journal of Agricultural and Food Chemistry,JEFimne2006flop#JEFedne2006flo#JEFrane2006flo#JEFimne2006floli#JEFimne2006floi#JEFimne2006flol
Identification of the Volatile Compounds of Flower Oil of Campomanesia pubescens (Myrtaceae),Claudia A.L. Cardoso & Nilva R√©-Poppi,https://doi.org/10.1080/10412905.2009.9700210,10.1080/10412905.2009.9700210,"VOL. 21, 433-434 (Sep/Oct 2009)",Journal of Essential Oil Research,JECpubr2009Flo
Identification of the Volatile Compounds of Flowers of Campomanesia sessiliflora O. Berg and Campomanesia xanthocarpa O. Berg,"Claudia L. Cardoso, Vanessa M.F. Kataoka & Nilva R√©-Poppi",https://doi.org/10.11606/d.9.2002.tde-17032015-085231,10.11606/d.9.2002.tde-17032015-085231,"VOL. 22, 254-256 (May/June 2010)",Journal of Essential Oil Research,JECsebr2010Flo#JECxabr2010Flo
Identification of the Volatile Compounds of Leaf Oil of Anacardium humile (Anacardiaceae),"Cristiane Regina Winck, Claudia A.L. Cardoso, Alex Haroldo Jeller, Nilva Re-Poppi, Rosemary Matias Coelho, Eloty Justina Dias Schelder.",https://doi.org/10.1080/10412905.2010.9700255,10.1080/10412905.2010.9700255,"VOL. 22, 11-12 (Jan/Feb 2010)",Journal of Essential Oil Research,JEAhubr2010Lea
Identification of the Volatile Compounds of Leaves and Flowers in Guavira (Campomanesia adamantium O. Berg.),"Isabel D. Coutinho, Nilva Re Poppi, Claudia L. Cardoso",https://doi.org/10.1080/10412905.2008.9700041,10.1080/10412905.2008.9700041,"VOL. 20, 405-407 (Sep/Oct 2008)",Journal of Essential Oil Research,JECaddobr2008flo#JECaddobr2008lea
Identification of Volatiles in Headspace Emitted from Mahonia japonica Flowers,"H.S.MacTavish, J.M.Picone, R.A.Clery",https://doi.org/10.1080/10412905.2003.9712127,10.1080/10412905.2003.9712127,"VOL. 15, 231-233 (July/Aug 2003)",Journal of Essential Oil Research,JEMjaunki2003Flo
In-vitro¬†Mycological activity of essential oil fromZingiber zerumbet¬†rhizomes,"Bhagya H. Madegowda, Parthepan Rameshwaran, Navya P. Nagaraju & Pushpa S. Murthy",https://doi.org/10.1080/10412905.2015.1079274,10.1080/10412905.2015.1079274,"VOL. 28, 81-88 (Jan/Feb 2016)",Journal of Essential Oil Research,JEZzein2016rhi
"In vitro antibacterial effect of exotic plants essential oils on the honeybee pathogen Paenibacillus larvae, causal agent of American foulbrood","S. R. Fuselli, S. B. Garc√≠a de la Rosa, M. J. Eguaras and R. Fritz",https://doi.org/10.5424/sjar/2010083-1261,10.5424/sjar/2010083-1261,"VOL. 8(3), 651-657 (2010)",Spanish Journal of Agricultural Research,JEMalit2010na#JECmait2010na#JEMviit2010na#JECnait2010na
In vitro Antimicrobial Activities of Essential Oils from Origanum minutiflorum and Sideritis erytrantha subsp. erytrantha on Phytopathogenic Bacteria,"S. Altundag, B. Aslim, S. Ozturk",https://doi.org/10.1080/10412905.2011.9700422,10.1080/10412905.2011.9700422,"VOL. 23, 4-8 (Jan/Feb 2011)",Journal of Essential Oil Research,JEOmitu2011Aer
In vitro Antimicrobial Activities of Essential Oils from Origanum minutiflorum and Sideritis erytrantha subsp. erytrantha on Phytopathogenic Bacteria,"S. Altundag, B. Aslim, S. Ozturk",https://doi.org/10.1080/10412905.2011.9700481,10.1080/10412905.2011.9700481,"VOL. 23, 4-8 (Jan/Feb 2011)",Journal of Essential Oil Research,JESertu2011Aer
"In Vitro Antioxidant, Antimicrobial, and Antiviral Activities of the Essential Oil and various Extracts from Herbal Parts and Callus Cultures of Origanum acutidens","Munevver Sokmen, Julia Serkedjieva, Dimitra Daferera, Medine Gulluce, Moschos Polissiou, Bektas Tepe, H. Askin Akpulat, Fikrettin Sahin,, Atalay Sokme",https://doi.org/10.1021/jf049859g,10.1021/jf049859g,"VOL. 52(11), 3309-3312 (2004)",Journal of Agricultural and Food Chemistry,JEOactu2004her
In vitro¬†antioxidant potentials and chemistry of essential oils and oleoresins from fresh and sun-dried¬†Mentha longifolia¬†L.,"Sunita Singh, S.S. Das, G. Singh, Marina Perotti, Carola Schuff & C√©sar A.N. Catal√°n",https://doi.org/10.1080/10412905.2014.977455,10.1080/10412905.2014.977455,"VOL. 27, 61-69 (Jan/Feb 2015)",Journal of Essential Oil Research,JETpasomo2015aer#JETsasomo2015aer
"Induced Mutants in M2 Generation and Selection for Enhanced Essential Oil Yield and Quality in Palmarosa (Cymbopogon martinii, Roxb.) Wats., var. <i>martinii","H. K. Srivastava, G. K. Satpute & A. A. Naqvi",https://doi.org/10.1080/10412905.2000.9699575,10.1080/10412905.2000.9699575,"VOL. 12, 501-506 (July/Aug 2000)",Journal of Essential Oil Research,JECmain2000Seempcontrol#JECmain2000SeeTriptaEMS18#JECmain2000SeeTrishnacontrol#JECmain2000SeeprceI44#JECmain2000SeeTriptagamma2#JECmain2000SeePRCgamma9#JECmain2000SeeprceI43#JECmain2000Seecd5#JECmain2000Seeems32#JECmain2000SeeTrishnagamma5#JECmain2000SeeprceI45#JECmain2000SeeTriptaEMS19#JECmain2000SeeTriptaEMA20#JECmain2000SeeTrishnaEl41#JECmain2000SeeTrishnagamma6#JECmain2000Seeems31#JECmain2000Seese#JECmain2000Seecd1#JECmain2000SeePRCgamma12#JECmain2000SeeTriptaEMS21#JECmain2000Seegamma13#JECmain2000SeeTriptagamma1#JECmain2000SeePRCcontrol#JECmain2000Seeprcel48#JECmain2000SeePRCgamma10#JECmain2000SeeTriptacontrol
"Induced Mutants in M2 Generation and Selection for Enhanced Essential Oil Yield and Quality in Palmarosa (Cymbopogon martinii, Roxb.) Wats., var. martinii","H. K. Srivastava, G. K. Satpute & A. A. Naqvi",https://doi.org/10.1080/10412905.2000.9699575,10.1080/10412905.2000.9699575,"VOL. 12, 501-506 (July/Aug 2000)",Journal of Essential Oil Research,JECmain2000SeeTrishnagamma8
"Influence of season, drying temperature and extraction time on the yield and chemical composition of  marmeleiro (Croton sonderianus) essential oil","Ana Val√©ria Vieira de Souza, Douglas de Britto, Uiliane Soares dos Santos, Luma dos Passos Bispo, Izabel Cristina Casanova Turatti, Norberto Peporine Lopes, Ana Paula de Oliveira & Jackson Roberto Guedes da Silva Almeida",https://doi.org/10.1080/10412905.2016.1178183,10.1080/10412905.2016.1178183,"VOL. 29, 76-84 (Jan/Feb 2017)",Journal of Essential Oil Research,JECcllavudidothpr2016Lea
"Influence of the harvesting time, temperature and drying period on Artigo basil (Ocimum basilicum L.) Essential Oil","Jose Luiz S. Carvalho FilhoI, Arie F. BlankI, Pericles B. AlvesII, Polyana A.D. EhlertI, Alberto S. MeloI, Socrates C.H. CavalcantiIII, Maria de Fatima Arrigoni-BlankI, Renata Silva-MannI",https://doi.org/10.1590/s0102-695x2006000100007,10.1590/s0102-695x2006000100007,"VOL. 16(1), 24-30 (Jan/Mar 2006)",Brazilian Journal of Pharmacognosy,JEObabr2006Lea
Influence of Vacuum Distillation Parameters on the Chemical Composition of a Five-Fold Sweet Orange Oil (Citrus sinensis Osbeck),"D.Lopes, A.C.Raga, G.R.Stuart, J.V. de Oliveira",https://doi.org/10.1080/10412905.2003.9698624,10.1080/10412905.2003.9698624,"VOL. 15, 108-111 (Nov/Dec 2003) ",Journal of Essential Oil Research,JECsibr2003Fru
Inhibition of Immediate-Type Allergic Reaction by Minthostachys verticillata (Griseb.) Epling Essential Oil,"Laura N. Cariddi, Adriana Panero, Mirta S. Demo, Liliana I. Sabini, Ana M. Maldonado, Margarita Grosso & Julio Zygadlo",https://doi.org/10.1080/10412905.2007.9699257,10.1080/10412905.2007.9699257,"VOL. 19, 190-196 (Mar/Apr 2007)",Journal of Essential Oil Research,JEMvear2007Lea
Inhibition of Spore Development and Mycelial Growth of Rhizopus stolonifer by Essential Oil of Satureja richingeri from Iran,"Malihe Safari, Arghavan Kamaly, Javad Hadian & Mohsen Farzaneh",https://doi.org/10.1080/10412905.2011.9712283,10.1080/10412905.2011.9712283,"VOL. 23, 5-10 (Nov/Dec 2011)",Journal of Essential Oil Research,JESriteir2011Who
Inhibitory and Compatibility Effects of Essential Oils on Sapstain and Biological Control Fungi,"Benjamin E.Dawson-Andoh,Rawle Lovell,D.Pascal Kamdem",https://doi.org/10.1080/10412905.2000.9699577,10.1080/10412905.2000.9699577,"VOL. 12, 109-515 (July/Aug 2000)",Journal of Essential Oil Research,JECnaca2000Her
Insecticidal Activity and Chemical Composition of Volatile Oils from Hyptis martiusii Benth,"Edigenia C. C. Araujo, Edilberto R. Silveira, Mary Anne S. Lima, Manoel Andrade Neto, Israel l. De andrade,, Marcos Aurelio A. Lima Gilvandete M. P. Santiago Antonio Lindemberg M. Mesquita",https://doi.org/10.1021/jf021074s,10.1021/jf021074s,"VOL. 51(13), 3760-3762 (2003)",Journal of Agricultural and Food Chemistry,JEHmabr2003Lea#JEHmabr2003Inf
Insecticidal Activity of the Essential Oil and Extracts of Gutierrezia mandonii and G. repens (Asteraceae) Growing in Argentina,"Sandra V. Clemente, Graciela Mareggiani, Berta E. Ju√°rez, Mar√≠a E. Mendiondo, Catalina M. van Baren, Paola Di Leo Lira, Adriana M. Broussalis, Arnaldo L. Bandoni & Graciela E. Ferraro",https://doi.org/10.1080/10412905.2008.9700036,10.1080/10412905.2008.9700036,"VOL. 20, 276-278 (May/June 2008)",Journal of Essential Oil Research,JEGrear2008Aer#JEGmaar2008Aer
Interactive Use of Linear Retention Indices on Polar and Apolar Columns with an MS- Library for Reliable Characterization of Australia Tea Tree and Other Melaleuca sp. Oils,"Robert Shellie, Philip Marriott, Giovanni Zappia, Luigi Mondello, Giovanni Dugo",https://doi.org/10.1080/10412905.2003.9698597,10.1080/10412905.2003.9698597,"VOL. 15, 305-312 (Sep/Oct 2003)",Journal of Essential Oil Research,JEMunweau2003lea#JEMalcosowaau2003lea#JEMallisowaau2003lea#JEMalbuau2003lea#JEMalweau2003lea#JEMalgrsowaau2003lea#JEMdeweau2003lea#JEMquweau2003lea#JEMarweau2003lea#JEMliweau2003lea
Intra and Interspecific Variations of yield and Chemical Composition of Essential Oils From Five Eucalyptus Species Growing in the Congo-Brazzaville. Corymbia Subgenus,"Thomus Silou, Aubin Nestor Loumouamou, Emile Loukakou, Jean-Claude Chalchat, Gilles Figueredo",https://doi.org/10.1080/10412905.2009.9700149,10.1080/10412905.2009.9700149,"VOL. 21, 203-211 (May/June 2009)",Journal of Essential Oil Research,JEEpoau2009lea
Intra and Interspecific Variations of yield and Chemical Composition of Essential Oils From Five Eucalyptus Species Growing in the Congo-Brazzaville. Corymbia Subgenus,"Thomus Silou, Aubin Nestor Loumouamou, Emile Loukakou, Jean-Claude Chalchat, Gilles Figueredo.",https://doi.org/10.1080/10412905.2009.9700149,10.1080/10412905.2009.9700149,"VOL. 21, 203-211 (May/June 2009)",Journal of Essential Oil Research,JEEmaau2009lea#JEEciau2009Leamj#JEEneau2009lea#JEEtoau2009Leamj
Intraspecific Variation of Tanacetum larvatum Essential Oil,"V. M. Tadiƒá, I. S. Aljanƒçiƒá, V. E. Vajsb, S. M. Milosavljeviƒá, D. Djokoviƒá & I. Djordjeviƒá",https://doi.org/10.1080/10412905.2010.9700355,10.1080/10412905.2010.9700355,"VOL. 22, 394-398 (Sep/Oct 2010)",Journal of Essential Oil Research,JETlamo2010Aer
Investigation of Leaf Essential Oil of Myrica gale L. From Quebec: Purification and Analysis of Oxygenated Fractions,"Muriel Sylvestre, Jean Legault, Serge Lavoie & Andr√© Pichette",https://doi.org/10.1080/10412905.2006.9699380,10.1080/10412905.2006.9699380,"VOL. 18, 38-41 (Jan/Feb 2006)",Journal of Essential Oil Research,JEMgaca2006Lea
Investigation of peel and leaf essential oils of Citrus clementina Hort ex Tan growing in the south of Vietnam,"Thao-Tran Thi Nguyen, Thanh-Tram Thi Tran, Tra-My Hua, The-Tai Diep, DuyKhiem Nguyen Chau, Fritz Duus and Thach Ngoc Le",https://doi.org/10.1080/10412905.2015.1083491,10.1080/10412905.2015.1083491,"VOL. 28, 96-103 (Mar/Apr 2016)",Journal of Essential Oil Research,JEDjoilhw2016Lea#JEDrequ2016Lea
"Investigation of the Essential Oil and Headspace of Laggera pterodonta (DC.) Sch. Bip. ex Oliv., a Medicinal Plant from Camerroon","Martin Benoit Ngassoum Leopold Jirovetz, Gerhard Buchbauer, Wilhelm Fleischhacker",https://doi.org/10.1080/10412905.2000.9699532,10.1080/10412905.2000.9699532,"VOL. 12, 345-349 (May/June 2000)",Journal of Essential Oil Research,JELptunofngadplofca2000ste#JELptunofngadplofca2000lea#JELptunofngadplofca2000flo
Investigation of the Essential Oil of Erigeron acris L. Herb,"Jolanta Nazaruk, Jan Gudej, Teresa Majda & Jozef G√≥ra",https://doi.org/10.1080/10412905.2006.9699394,10.1080/10412905.2006.9699394,"VOL. 18, 88-90 (Jan/Feb 2006)",Journal of Essential Oil Research,JEEacpo2006Her
"Investigation of the Essential Oil of Feminine Cones, Leaves and Branches of Taxodium distichum from Italy.","Guido Flamini, pier Luigi loni, Ivano Morelli.",https://doi.org/10.1080/10412905.2000.9699523,10.1080/10412905.2000.9699523,"VOL. 12, 310-312 (May/June 2000)",Journal of Essential Oil Research,JETdinotuit2000Fem#JETdinotuit2000Bra#JETdinotuit2000Lea
"Investigation of the Essential Oils of Bidens pilosa var. minor, Bidens alba and Flaveria linearis","Horacio A. Priestap, Bradley C. Bennett & J. Martin E. Quirke",https://doi.org/10.1080/10412905.2008.9700039,10.1080/10412905.2008.9700039,"VOL. 20, 396-402 (Sep/Oct 2008)",Journal of Essential Oil Research,JEBpiar2008Ste#JEBpiar2008Lea#JEBalar2008Lea#JEFliar2008Roo#JEBalar2008Flo#JEBpiar2008Roo#JEBpiar2008Flo#JEFliar2008Ste#JEFliar2008Lea#JEFliar2008Inf#JEBalar2008Roo#JEBalar2008Ste
Investigation on Himalayan Artemisia Species VI: Essential Oil Constituents of Artemisia myriantha Wall. ex Bess. var. pleiocephala (Pamp.) Ling.,G. C. Shah & C. S. Mathela,https://doi.org/10.1080/10412905.2006.9699188,10.1080/10412905.2006.9699188,"VOL. 18, 633-634 (Sep/Oct 2006)",Journal of Essential Oil Research,JEAmygahiin2006Aer
"Investigations on bioactivity of essential oil of Ageratum Conyzoides L., from benin against the growth of fungi and aflatoxin production.","Euloge S. Adjou, Edwige Dahouenon-Ahoussi, Ren√© Degnon, Mohamed M. Soumanou, Dominique C.K. Sohounhloue.",http://dx.doi.org/10.5138/09750185.2251,http://dx.doi.org/10.5138/09750185.2251,NA,NA,JEACobaceofbel201Lea
Isolation and Chiral GC Analysis of Beta-Besabolols-Trace Constituents from the Essential Oil of Santalum album L. (Santalaceae).,"Norbert A. Braun, Manfred Meier, Wilhelm Pickenhagen.",https://doi.org/10.1080/10412905.2003.9712064,10.1080/10412905.2003.9712064,"VOL. 15, 63-65 (Mar/Apr 2003)",Journal of Essential Oil Research,JESaltanain2003Woo
Isolation of Anisyl Acetone from Agarwood Oil.,"Manfred Meier, Birgit Kohlenberg, Nobert A. Braun.",https://doi.org/10.1080/10412905.2003.9712266,10.1080/10412905.2003.9712266,"VOL. 15, 54-56 (Jan/Feb 2003)",Journal of Essential Oil Research,JEAagchin2003Ste
Isolation of Rosemary Oils by Different Processes,"C. Boutekedjiret, R. Belabbes, F. Bentahar, J.-M. Bessiere, S.A. Rezzoug",https://doi.org/10.1080/10412905.2004.9698696,10.1080/10412905.2004.9698696,"VOL. 16, 195-199 (May/June 2004)",Journal of Essential Oil Research,JERofal2004Whoi#JERofal2004Whow#JERofal2004Whoh#JERofal2004Whod#JERofal2004Whoe#JERofal2004Whos
Isolation of Thymus herba-barona Volatiles by Supercritical FIuid Extraction,"Barbara De Gioannis, Bruno Marongiu & Silvia Porcedda",https://doi.org/10.1080/10412905.2001.9699682,10.1080/10412905.2001.9699682,"VOL. 13, 240-244 (July/Aug 2001)",Journal of Essential Oil Research,JEThecesa2001Aer
"Kadsura oblongifolia Merr. leaves, stem bark and root bark essential oils","Do N. Dai , Nguyen N. Tuan , Tran D. Thang & Isiaka A. Ogunwande",https://doi.org/10.1080/10412905.2014.922509,10.1080/10412905.2014.922509,"VOL. 26, 372‚Äì376 (Sep/Oct)",Journal of Essential Oil Research,JEKobvi2014lea#JEKobvi2014roo#JEKobvi2014ste
Kessane in the Indian Celery Seed Oils,"J. Philippe, G. Suvar.nalatha, R. Sankar, S. Suresh",https://doi.org/10.1080/10412905.2002.9699852,10.1080/10412905.2002.9699852,"VOL. 14, 276-277 (July/Aug 2002)",Journal of Essential Oil Research,JEAgrkain2002See
Kessane in the Indian Celery Seed Oils,"J. Philippe, G. Suvarnalatha, R. Sankar & S. Suresh",https://doi.org/10.1080/10412905.2002.9699852,10.1080/10412905.2002.9699852,"VOL. 14, 276-277 (July/Aug 2002)",Journal of Essential Oil Research,JEAgrin2002See
Laboratory Evaluation of Heterothalamus alienus Essential Oil Against Different Pests of Apis mellifera,"Sergio R. Ruffinengo, Mat√≠as Maggi, Sandra Fuselli, Ignazio Floris, Gladys Clemente, Norberto H. Firpo, Pedro N. Bailac & Marta I. Ponzi",https://doi.org/10.1080/10412905.2006.9699211,10.1080/10412905.2006.9699211,"VOL. 18, 704-707 (Nov/Dec 2006)",Journal of Essential Oil Research,JEHalar2006Aer
Laboratory Evaluations of Syzygium aromaticum (L.) Merr. et Perry Essential Oil Against Varroa destructor,"Mat√≠as D. Maggi, Sergio R. Ruffnengo, Liesel B. Gende, Edgardo G. Sarlo, Mart√≠n J. Eguaras, Pedro N. Bailac & Marta I. Ponzi",https://doi.org/10.1080/10412905.2010.9700278,10.1080/10412905.2010.9700278,"VOL. 22, 119-122 (Mar/Apr 2010)",Journal of Essential Oil Research,JESarar2010Flo
Larvicidal activity of two algerian verbenaceae essential oils against culex pipiens,"Safia Zoubiria, Aoumeur Baaliouamera",https://doi.org/10.1016/j.vetpar.2011.04.033,10.1016/j.vetpar.2011.04.033,NA,NA,JELcaal2011Aer
Leaf essential oil composition of Inula cuspidata (Wall. ex DC.) C.B. Clarke from India,"Ram S. Verma, Rajendra C. Padalia & Amit Chauhan",https://doi.org/10.1080/10412905.2014.891264,10.1080/10412905.2014.891264,"VOL. 26, 233-237 (July/August 2014)",Journal of Essential Oil Research,JEIcuin2014lea
Leaf Essential Oil of Mentha grandiflora Benth. (Lamiaceae),"Joseph J. B r o p h v and Robert J. Goldpack,Paul I. Forster,Christopher J. R Fwkes",https://doi.org/10.1080/10412905.1997.9700749,10.1080/10412905.1997.9700749,VOL. 9 459-461 (July/Aug 1997),Journal of Essential Oil Research,JEMgrqu1997Lea
Leaf Essential Oil of Piper barbatum H.B.K. (Piperaceae) from Peru.,"Liliana Vergas, Maria Jose Perez-Alonso, Arturo Velasco-Negueruela, Jesus Pala-Paul, Maria Concepcion Garcia Vallejo.",https://doi.org/10.1080/10412905.2003.9712102,10.1080/10412905.2003.9712102,"VOL. 15, 163-164 (May/June 2003)",Journal of Essential Oil Research,JEPbaamdepeco2003Lea
"Leaf Essential Oils of Lycopus australis(Lamiaceae), the Austrlian Gipsywort","Joseph J.Brophy, Robert J.Goldsack, Paul I. Forster",https://doi.org/10.1080/10412905.2005.9698854,10.1080/10412905.2005.9698854,"VOL. 17, 133-134 (Mar/Apr 2005)",Journal of Essential Oil Research,JELauau2005lea
Leaf Essential Oils of Some Leptospermum (Myrtaceae) Species from Southern and Western Australia,"Joseph J. Brophy, Robert J. Goldsack & Erich V. Lassak",https://doi.org/10.1080/10412905.1999.9701053,10.1080/10412905.1999.9701053,"VOL. 11, 1-5 (Jan/Feb 1999)",Journal of Essential Oil Research,JELniau1999Lea#JELcoau1999Lea#JELfaau1999Lea
Leaf Essential Oils of the Australian Species of Gyrocarpus and Hernandia (Hernandiaceae).,"Joseph J. Brophy, Robert J. Goldsack, Paul I. Forster.",https://doi.org/10.1080/10412905.2000.9712199,10.1080/10412905.2000.9712199,"VOL. 12, 717-722 (Nov/Dec 2000)",Journal of Essential Oil Research,JEHnyquheau2000Lea#JEHbiquheau2000Lea#JEGamquheau2000Lea#JEHalquheau2000Lea
Leaf Essential Oils of the Genus Waterhousea (Myrtaceae),"Joseph J. Brophy, Robert J. Goldsack,Christopher J.R Fookes, Paul I. Forster",https://doi.org/10.1080/10412905.2002.9699753,10.1080/10412905.2002.9699753,"VOL. 14, 31-34 (Jan/Feb 2002)",Journal of Essential Oil Research,JEWflencrqu2002lea#JEWmumuqu2002lea#JEWhehacrqu2002lea#JEWunmoqu2002lea
Leaf of Tamarindus indica L.,"Jorge A. Pino, Julio C. Escalona, Irina Licea, Renato Perez, Juan Aguero.",,,"VOL. 14, 187-188 (May/June 2002)",Journal of Essential Oil Research,JETincu2002Lea
Leaf Oil of Artemisia abrotanum L. Grown in Cuba,"J. A. Pino, R. Marbot & M. Pilar Mart√≠",https://doi.org/10.1080/10412905.2011.9700438,10.1080/10412905.2011.9700438,"VOL. 23, 119-120 (Jan/Feb 2011)",Journal of Essential Oil Research,JEAabhacu2011Lea
Leaf Oil of Backhousia enata (Myrtaceae),"Joseph J. Brophy, Robert J. Goldsack, Lyn A. Craven & Andrew J. Ford",https://doi.org/10.1080/10412905.2007.9699221,10.1080/10412905.2007.9699221,"VOL. 19, 26-27 (Jan/Feb 2007)",Journal of Essential Oil Research,JEBenau2007Lea
Leaf Oil of Campomanesia sessiliflora O. Berg,"Claudia L. Cardoso, Vanessa M.F. Kataoka & Nilva R√©-Poppi",https://doi.org/10.1080/10412905.2010.9700330,10.1080/10412905.2010.9700330,"VOL. 22, 303-304 (July/Aug 2010)",Journal of Essential Oil Research,JECsebr2010Lea
Leaf Oil of Eugenia axillaris (Sw.) Willd. from Cuba,"Jorge A. Pino, Avilio Bello, Armando Urguiola, Juan Aguero",https://doi.org/10.1080/10412905.2003.9712249,10.1080/10412905.2003.9712249,"VOL. 15, 15-16 (Jan/Feb 2003)",Journal of Essential Oil Research,JEEaxcu2003lea
Leaf Oil of Eugenia rocana Britt. et Wils. from Cuba,"Jorge A. Pino, Avilio Bello, Armando Urguiola, Juan Aguero",https://doi.org/10.1080/10412905.2002.9699905,10.1080/10412905.2002.9699905,"VOL. 14, 412-413 (Nov/Dec 2002)",Journal of Essential Oil Research,JEErocu2002lea
Leaf Oil of Psidium salutare (HBK) Berg. from Cuba,"Jorge A. Pino, Avilio Bello, Armando Urguiola, Juan Aguero",https://doi.org/10.1080/10412905.2003.9712251,10.1080/10412905.2003.9712251,"VOL. 15, 19-20 (Jan/Feb 2003)",Journal of Essential Oil Research,JEPsacu2003lea
Leaf Oil of Xylopia aromatica (Lam.) Mart. From Cuba.,"Jorge A. Pino, Avilio Bello, Aromando Urquiola, Sergio Garcia, Aristides Rosado.",https://doi.org/10.1080/10412905.2000.9712207,10.1080/10412905.2000.9712207,"VOL. 12, 751-752 (Nov/Dec 2000)",Journal of Essential Oil Research,JEXarpidericu2000Lea
"Leaf Oils of Helichrysum melaleucum Rchb. ex Holl.,Oenanthe divaricata (R. Br.) Mabb. and Persea indica (L.) Spreng. from Madeira","Jorge A. Pino, Paulo Fernandes, Rolando Marbot, Ar√≠stides Rosado & Susana S√° Fontinha",https://doi.org/10.1080/10412905.2004.9698778,10.1080/10412905.2004.9698778,"VOL. 16, 487-489 (Sep/Oct 2004)",Journal of Essential Oil Research,JEOdimais2004Lea
"Leaf Oils of Helichrysum melaleucum Rchb.ex Holl., Oenanthe divaricata (R. Br.) and Persea indica (L.) Spreng. from Madeira.","Jorge A. Pino,Paulo Fernandes,Rolando Marbot, Aristides Rosado Susana Sa Fontinha",https://doi.org/10.1080/10412905.2004.9698778,10.1080/10412905.2004.9698778,"VOL. 16, 487-489 (Sep/Oct 2004)",Journal of Essential Oil Research,JEHmema2004lea
Leaf Oils of Koanophyllon villosum (Sw.) King et Robins.,"Jorge A. Pino,,Rolando Marbot, Armando Payo, Daniel Chao, Pedro Herrera, M. Pilar Marti",https://doi.org/10.1080/10412905.2005.9698951,10.1080/10412905.2005.9698951,"VOL. 17, 427-428 (July/Aug 2005)",Journal of Essential Oil Research,JEKvicu2005lea
Leaf Oils of Psidium cymosum Urb. and Psidium sartorianum Niedz. from Cuba,"Jorge A. Pino, Avilio Bello, Armando Urguiola, Juan Aguero, Rolando Marbot",https://doi.org/10.1080/10412905.2003.9712107,10.1080/10412905.2003.9712107,"VOL. 15, 187-188 (May/June 2003)",Journal of Essential Oil Research,JEPcycu2003lea
Leaf Oils of Psidium parvifolium Griseb. and Psidium cattleianum Sabine from Cuba,"Jorge A. Pino, Avilio Bello, Armando Urquiola, Rolando Marbot & M. Pilar Mart√≠",https://doi.org/10.1080/10412905.2004.9698745,10.1080/10412905.2004.9698745,"VOL. 16, 370-371 (July/Aug 2004)",Journal of Essential Oil Research,JEPcacu2004Lea#JEPpacu2004Lea
"Leaf Oils of the Genera Barongia, Mitrantia, Sphaerantia and Ristantia (Myrtaceae)","Joseph J. Brophy, Robert J. Goldsack & Paul I. Forster",https://doi.org/10.1080/10412905.2003.9712126,10.1080/10412905.2003.9712126,"VOL. 15, 226-230 (Julv/August 2003)",Journal of Essential Oil Research,JERgoau2003Lea#JESdiau2003Lea#JERwaau2003Lea#JERpaau2003Lea
"Leaf Oils of the Genera Barongia, Mitrantia, Sphaerantia and Ristantia (Myrtaceae)","Joseph J. Brophy, Robert J. Goldsack & Paul I. Forster",https://doi.org/10.1080/10412905.2003.9712126,10.1080/10412905.2003.9712126,"VOL. 15, 226-230 (July/Aug 2003)",Journal of Essential Oil Research,JERgoau2003Lea#JERpaau2003Lea#JESdiau2003Lea#JERwaau2003Lea
